{
	"schema_version": "1.0.0",
	"package": "vormaclient/client",
	"scope": {
		"statement": "Reconstruction-grade runtime contract for vormaclient/client package entrypoint.",
		"owned_surface": [
			"All runtime and type exports from vormaclient/client/index.ts.",
			"Package-owned event keys, storage keys, query params, and headers used by exported APIs.",
			"Observable runtime behavior implemented in this package."
		],
		"out_of_scope": [
			"Dependency internals in history and vorma/kit modules.",
			"Browser engine internals and build tooling implementation details."
		]
	},
	"runtime_export_coverage": {
		"exports": [
			{
				"symbol": "getBuildID",
				"kind": "function",
				"classification": "OWNED_RUNTIME_BEHAVIOR",
				"contract_coverage": ["REQ-VORMACLIENT-CLIENT-005"]
			},
			{
				"symbol": "getHistoryInstance",
				"kind": "function",
				"classification": "OWNED_RUNTIME_BEHAVIOR",
				"contract_coverage": ["REQ-VORMACLIENT-CLIENT-005"]
			},
			{
				"symbol": "getLocation",
				"kind": "function",
				"classification": "OWNED_RUNTIME_BEHAVIOR",
				"contract_coverage": ["REQ-VORMACLIENT-CLIENT-005"]
			},
			{
				"symbol": "getRootEl",
				"kind": "function",
				"classification": "OWNED_RUNTIME_BEHAVIOR",
				"contract_coverage": ["REQ-VORMACLIENT-CLIENT-005"]
			},
			{
				"symbol": "getStatus",
				"kind": "function",
				"classification": "OWNED_RUNTIME_BEHAVIOR",
				"contract_coverage": ["REQ-VORMACLIENT-CLIENT-005"]
			},
			{
				"symbol": "revalidate",
				"kind": "function",
				"classification": "OWNED_RUNTIME_BEHAVIOR",
				"contract_coverage": ["REQ-VORMACLIENT-CLIENT-006"]
			},
			{
				"symbol": "submit",
				"kind": "function",
				"classification": "OWNED_RUNTIME_BEHAVIOR",
				"contract_coverage": ["REQ-VORMACLIENT-CLIENT-007"]
			},
			{
				"symbol": "vormaNavigate",
				"kind": "function",
				"classification": "OWNED_RUNTIME_BEHAVIOR",
				"contract_coverage": ["REQ-VORMACLIENT-CLIENT-006"]
			},
			{
				"symbol": "__registerClientLoaderPattern",
				"kind": "function",
				"classification": "OWNED_RUNTIME_BEHAVIOR",
				"contract_coverage": ["REQ-VORMACLIENT-CLIENT-009"]
			},
			{
				"symbol": "defaultErrorBoundary",
				"kind": "function",
				"classification": "OWNED_RUNTIME_BEHAVIOR",
				"contract_coverage": ["REQ-VORMACLIENT-CLIENT-002"]
			},
			{
				"symbol": "addBuildIDListener",
				"kind": "function",
				"classification": "OWNED_RUNTIME_BEHAVIOR",
				"contract_coverage": ["REQ-VORMACLIENT-CLIENT-001"]
			},
			{
				"symbol": "addLocationListener",
				"kind": "function",
				"classification": "OWNED_RUNTIME_BEHAVIOR",
				"contract_coverage": ["REQ-VORMACLIENT-CLIENT-001"]
			},
			{
				"symbol": "addRouteChangeListener",
				"kind": "function",
				"classification": "OWNED_RUNTIME_BEHAVIOR",
				"contract_coverage": ["REQ-VORMACLIENT-CLIENT-001"]
			},
			{
				"symbol": "addStatusListener",
				"kind": "function",
				"classification": "OWNED_RUNTIME_BEHAVIOR",
				"contract_coverage": ["REQ-VORMACLIENT-CLIENT-001"]
			},
			{
				"symbol": "setupGlobalLoadingIndicator",
				"kind": "function",
				"classification": "OWNED_RUNTIME_BEHAVIOR",
				"contract_coverage": ["REQ-VORMACLIENT-CLIENT-012"]
			},
			{
				"symbol": "__runClientLoadersAfterHMRUpdate",
				"kind": "function",
				"classification": "OWNED_RUNTIME_BEHAVIOR",
				"contract_coverage": ["REQ-VORMACLIENT-CLIENT-013"]
			},
			{
				"symbol": "initClient",
				"kind": "function",
				"classification": "OWNED_RUNTIME_BEHAVIOR",
				"contract_coverage": ["REQ-VORMACLIENT-CLIENT-008"]
			},
			{
				"symbol": "__getPrefetchHandlers",
				"kind": "function",
				"classification": "OWNED_RUNTIME_BEHAVIOR",
				"contract_coverage": ["REQ-VORMACLIENT-CLIENT-010"]
			},
			{
				"symbol": "__makeLinkOnClickFn",
				"kind": "function",
				"classification": "OWNED_RUNTIME_BEHAVIOR",
				"contract_coverage": ["REQ-VORMACLIENT-CLIENT-010"]
			},
			{
				"symbol": "__applyScrollState",
				"kind": "function",
				"classification": "OWNED_RUNTIME_BEHAVIOR",
				"contract_coverage": ["REQ-VORMACLIENT-CLIENT-011"]
			},
			{
				"symbol": "route",
				"kind": "function",
				"classification": "COMPILE_TIME_ONLY_OR_NOOP",
				"contract_coverage": ["REQ-VORMACLIENT-CLIENT-014"]
			},
			{
				"symbol": "__makeFinalLinkProps",
				"kind": "function",
				"classification": "OWNED_RUNTIME_BEHAVIOR",
				"contract_coverage": ["REQ-VORMACLIENT-CLIENT-015"]
			},
			{
				"symbol": "makeTypedNavigate",
				"kind": "function",
				"classification": "OWNED_RUNTIME_BEHAVIOR",
				"contract_coverage": ["REQ-VORMACLIENT-CLIENT-016"]
			},
			{
				"symbol": "__resolvePath",
				"kind": "function",
				"classification": "OWNED_RUNTIME_BEHAVIOR",
				"contract_coverage": ["REQ-VORMACLIENT-CLIENT-017"]
			},
			{
				"symbol": "buildMutationURL",
				"kind": "function",
				"classification": "OWNED_RUNTIME_BEHAVIOR",
				"contract_coverage": ["REQ-VORMACLIENT-CLIENT-017"]
			},
			{
				"symbol": "buildQueryURL",
				"kind": "function",
				"classification": "OWNED_RUNTIME_BEHAVIOR",
				"contract_coverage": ["REQ-VORMACLIENT-CLIENT-017"]
			},
			{
				"symbol": "resolveBody",
				"kind": "function",
				"classification": "OWNED_RUNTIME_BEHAVIOR",
				"contract_coverage": ["REQ-VORMACLIENT-CLIENT-017"]
			},
			{
				"symbol": "__vormaClientGlobal",
				"kind": "object",
				"classification": "OWNED_RUNTIME_BEHAVIOR",
				"contract_coverage": ["REQ-VORMACLIENT-CLIENT-003"]
			},
			{
				"symbol": "getRouterData",
				"kind": "function",
				"classification": "OWNED_RUNTIME_BEHAVIOR",
				"contract_coverage": ["REQ-VORMACLIENT-CLIENT-004"]
			},
			{
				"symbol": "revalidateOnWindowFocus",
				"kind": "function",
				"classification": "OWNED_RUNTIME_BEHAVIOR",
				"contract_coverage": ["REQ-VORMACLIENT-CLIENT-018"]
			},
			{
				"symbol": "SubmitOptions",
				"kind": "type_export",
				"classification": "COMPILE_TIME_ONLY_OR_NOOP",
				"contract_coverage": ["REQ-VORMACLIENT-CLIENT-019"]
			},
			{
				"symbol": "RouteChangeEvent",
				"kind": "type_export",
				"classification": "COMPILE_TIME_ONLY_OR_NOOP",
				"contract_coverage": ["REQ-VORMACLIENT-CLIENT-019"]
			},
			{
				"symbol": "StatusEvent",
				"kind": "type_export",
				"classification": "COMPILE_TIME_ONLY_OR_NOOP",
				"contract_coverage": ["REQ-VORMACLIENT-CLIENT-019"]
			},
			{
				"symbol": "VormaLinkPropsBase",
				"kind": "type_export",
				"classification": "COMPILE_TIME_ONLY_OR_NOOP",
				"contract_coverage": ["REQ-VORMACLIENT-CLIENT-019"]
			},
			{
				"symbol": "ParamsForPattern",
				"kind": "type_export",
				"classification": "COMPILE_TIME_ONLY_OR_NOOP",
				"contract_coverage": ["REQ-VORMACLIENT-CLIENT-019"]
			},
			{
				"symbol": "UseRouterDataFunction",
				"kind": "type_export",
				"classification": "COMPILE_TIME_ONLY_OR_NOOP",
				"contract_coverage": ["REQ-VORMACLIENT-CLIENT-019"]
			},
			{
				"symbol": "VormaRouteGeneric",
				"kind": "type_export",
				"classification": "COMPILE_TIME_ONLY_OR_NOOP",
				"contract_coverage": ["REQ-VORMACLIENT-CLIENT-019"]
			},
			{
				"symbol": "ExtractApp",
				"kind": "type_export",
				"classification": "COMPILE_TIME_ONLY_OR_NOOP",
				"contract_coverage": ["REQ-VORMACLIENT-CLIENT-019"]
			},
			{
				"symbol": "PermissivePatternBasedProps",
				"kind": "type_export",
				"classification": "COMPILE_TIME_ONLY_OR_NOOP",
				"contract_coverage": ["REQ-VORMACLIENT-CLIENT-019"]
			},
			{
				"symbol": "VormaAppBase",
				"kind": "type_export",
				"classification": "COMPILE_TIME_ONLY_OR_NOOP",
				"contract_coverage": ["REQ-VORMACLIENT-CLIENT-019"]
			},
			{
				"symbol": "VormaAppConfig",
				"kind": "type_export",
				"classification": "COMPILE_TIME_ONLY_OR_NOOP",
				"contract_coverage": ["REQ-VORMACLIENT-CLIENT-019"]
			},
			{
				"symbol": "VormaLoaderOutput",
				"kind": "type_export",
				"classification": "COMPILE_TIME_ONLY_OR_NOOP",
				"contract_coverage": ["REQ-VORMACLIENT-CLIENT-019"]
			},
			{
				"symbol": "VormaLoaderPattern",
				"kind": "type_export",
				"classification": "COMPILE_TIME_ONLY_OR_NOOP",
				"contract_coverage": ["REQ-VORMACLIENT-CLIENT-019"]
			},
			{
				"symbol": "VormaMutationInput",
				"kind": "type_export",
				"classification": "COMPILE_TIME_ONLY_OR_NOOP",
				"contract_coverage": ["REQ-VORMACLIENT-CLIENT-019"]
			},
			{
				"symbol": "VormaMutationOutput",
				"kind": "type_export",
				"classification": "COMPILE_TIME_ONLY_OR_NOOP",
				"contract_coverage": ["REQ-VORMACLIENT-CLIENT-019"]
			},
			{
				"symbol": "VormaMutationPattern",
				"kind": "type_export",
				"classification": "COMPILE_TIME_ONLY_OR_NOOP",
				"contract_coverage": ["REQ-VORMACLIENT-CLIENT-019"]
			},
			{
				"symbol": "VormaMutationProps",
				"kind": "type_export",
				"classification": "COMPILE_TIME_ONLY_OR_NOOP",
				"contract_coverage": ["REQ-VORMACLIENT-CLIENT-019"]
			},
			{
				"symbol": "VormaQueryInput",
				"kind": "type_export",
				"classification": "COMPILE_TIME_ONLY_OR_NOOP",
				"contract_coverage": ["REQ-VORMACLIENT-CLIENT-019"]
			},
			{
				"symbol": "VormaQueryOutput",
				"kind": "type_export",
				"classification": "COMPILE_TIME_ONLY_OR_NOOP",
				"contract_coverage": ["REQ-VORMACLIENT-CLIENT-019"]
			},
			{
				"symbol": "VormaQueryPattern",
				"kind": "type_export",
				"classification": "COMPILE_TIME_ONLY_OR_NOOP",
				"contract_coverage": ["REQ-VORMACLIENT-CLIENT-019"]
			},
			{
				"symbol": "VormaQueryProps",
				"kind": "type_export",
				"classification": "COMPILE_TIME_ONLY_OR_NOOP",
				"contract_coverage": ["REQ-VORMACLIENT-CLIENT-019"]
			},
			{
				"symbol": "VormaRoutePropsGeneric",
				"kind": "type_export",
				"classification": "COMPILE_TIME_ONLY_OR_NOOP",
				"contract_coverage": ["REQ-VORMACLIENT-CLIENT-019"]
			},
			{
				"symbol": "ClientLoaderAwaitedServerData",
				"kind": "type_export",
				"classification": "COMPILE_TIME_ONLY_OR_NOOP",
				"contract_coverage": ["REQ-VORMACLIENT-CLIENT-019"]
			}
		],
		"summary": {